{
  "$schema": "../../../schemas/case.schema.json",
  "case_id": "paired-task-66",
  "title": "配对任务 66（有插件）：跨 CODEOWNERS 拆分 PR OWN_SPLIT + NDJSON",
  "owner": "product-eval",
  "tags": [
    "coding"
  ],
  "lifecycle": "released",
  "automation_readiness": "design_ready",
  "head_revision_id": "paired-task-66.r3.on",
  "pair_key": "PAIRED-TASK-66"
}
