{
  "$schema": "../../../schemas/case.schema.json",
  "case_id": "paired-task-33",
  "title": "配对任务 33（有插件）：过大变更拆分 SMALL_CL + NDJSON",
  "owner": "product-eval",
  "tags": [
    "coding"
  ],
  "lifecycle": "released",
  "automation_readiness": "design_ready",
  "head_revision_id": "paired-task-33.r3.on",
  "pair_key": "PAIRED-TASK-33"
}
