{
  "$schema": "../../../schemas/case.schema.json",
  "case_id": "paired-task-99",
  "title": "配对任务 99（有插件）：供应链 SBOM SBOM_OK + NDJSON",
  "owner": "product-eval",
  "tags": ["coding"],
  "lifecycle": "released",
  "automation_readiness": "design_ready",
  "head_revision_id": "paired-task-99.r3.on",
  "pair_key": "PAIRED-TASK-99"
}
