{
  "$schema": "../../../schemas/case.schema.json",
  "case_id": "paired-task-79",
  "title": "配对任务 79（有插件）：幂等重试 IDEMPOTENT + NDJSON",
  "owner": "product-eval",
  "tags": [
    "coding"
  ],
  "lifecycle": "released",
  "automation_readiness": "design_ready",
  "head_revision_id": "paired-task-79.r3.on",
  "pair_key": "PAIRED-TASK-79"
}
