{
  "$schema": "../../../schemas/case.schema.json",
  "case_id": "paired-task-30",
  "title": "配对任务 30（有插件）：PR 描述 What+Why PR_DESC + NDJSON",
  "owner": "product-eval",
  "tags": [
    "coding"
  ],
  "lifecycle": "released",
  "automation_readiness": "design_ready",
  "head_revision_id": "paired-task-30.r3.on",
  "pair_key": "PAIRED-TASK-30"
}
