{
  "$schema": "../../../schemas/case.schema.json",
  "case_id": "paired-task-153",
  "title": "配对任务 153（有插件）：依赖 SLA 对齐 DEP_SLA + NDJSON",
  "owner": "product-eval",
  "tags": ["coding"],
  "lifecycle": "released",
  "automation_readiness": "design_ready",
  "head_revision_id": "paired-task-153.r3.on",
  "pair_key": "PAIRED-TASK-153"
}
