{
  "$schema": "../../../schemas/case.schema.json",
  "case_id": "demo-b-tool-schema-05",
  "title": "模型矩阵夹具题 05：须调用 todowrite 并填齐必填字段",
  "owner": "demo",
  "tags": ["schema", "matrix", "fixture"],
  "lifecycle": "released",
  "automation_readiness": "design_ready",
  "head_revision_id": "demo-b-tool-schema-05.r1"
}
