{
  "$schema": "../../../schemas/case.schema.json",
  "case_id": "paired-task-109",
  "title": "配对任务 109（有插件）：队列积压治理 QUEUE_BACK + NDJSON",
  "owner": "product-eval",
  "tags": [
    "coding"
  ],
  "lifecycle": "released",
  "automation_readiness": "design_ready",
  "head_revision_id": "paired-task-109.r3.on",
  "pair_key": "PAIRED-TASK-109"
}
