{
  "$schema": "../../../schemas/case.schema.json",
  "case_id": "paired-task-06",
  "title": "配对任务 06（有插件）：风险门 RISK_OK + NDJSON",
  "owner": "product-eval",
  "tags": ["risk-gate"],
  "lifecycle": "released",
  "automation_readiness": "design_ready",
  "head_revision_id": "paired-task-06.r3.on",
  "pair_key": "PAIRED-TASK-06"
}
